<?xml version="1.0" encoding="UTF-8"?> 
<?xml-stylesheet type="text/xsl" href="community.xsl"?>
 <com xmlns:xsi="http://www.w3.org/2001/XMLSchema-instance"
xsi:noNamespaceSchemaLocation="community.xsd">
  <info> 
   <name>John</name> 
   <role>CEO</role> 
   <exp>2 Year</exp> 
   <working>Yes</working>
  </info>
  <info> 
   <name>Smith</name> 
   <role>COO</role> 
   <exp>1 Year</exp> 
   <working>Yes</working>
  </info> 
  <info> 
   <name>Paul</name> 
   <role>Analyst</role> 
   <exp>1 Year</exp> 
   <working>Yes</working>
  </info>  
 </com> 